{
  "schema": "engineering-standards.repository-adoption.v26.9.21",
  "repository": "seanchatmangpt/agile-protocol-specification",
  "base_sha": "5c31d9d05fe36dc1eca3a26c9eb5cd267a2cf625",
  "mode": "SEMANTIC_WORK",
  "role": "predecessor constitutional evidence and compatibility profile",
  "root": {
    "repository": "seanchatmangpt/engineering-standards",
    "sha": "5a3bb6446aeaee2255a7523d4d8cebf6042960c3",
    "version": "26.9.21"
  },
  "local_constitution": "AGENTS.md",
  "project_profile": "semantic/engineering-standards-profile.ttl",
  "standing": "UNKNOWN",
  "generator_identity": "engineering-standards/scripts/render-repository-adoption.py",
  "non_claims": [
    "root adoption does not prove local runtime behavior",
    "root adoption does not grant merge, release, deploy, or external DO authority",
    "local repository courts remain authoritative for local runtime standing"
  ]
}
